MARKER_ID,SHOP_NAME,SHOP_ADDRESS,LATITUDE,LONGITUDE
PMC,SGPMC1574_Lô TM SII.05 – TT Block Venus DA KDC Và TMHH Khải Vy,"Lô TM SII.05 – TT Block Venus DA KDC Và TMHH Khải Vy, Phường Phú Thuận, Quận 7, Thành phố Hồ Chí Minh",10.7220471023,106.7427049761
PMC,SGPMC206_76 Nguyễn Thị Thập,"76 Nguyễn Thị Thập, Phường Bình Thuận, Quận 7, Thành phố Hồ Chí Minh",10.7378792,106.7243096
PMC,SGPMC307_81 đường 30 tháng 4,"81 đường 30 tháng 4, Phường Hưng Lợi, Quận Ninh Kiều, Thành phố Cần Thơ",10.0116561167,105.7594010421
PMC,SGPMC956_509A/19 Quốc lộ 91B,"509A/19 Quốc lộ 91B, Phường Long Hòa, Quận Bình Thuỷ, Thành phố Cần Thơ",10.0362836,105.745128
PMC,SGPMC779_92 Nguyễn Trung Trực,"92 Nguyễn Trung Trực, Phường Vĩnh Bảo, Thành phố Rạch Giá, Tỉnh Kiên Giang",10.0040697,105.0872297
PMC,SGPMC868_604 Trịnh Thị Miếng,"604 Trịnh Thị Miếng, Xã Thới Tam Thôn, Huyện Hóc Môn, Thành phố Hồ Chí Minh",10.8882854,106.6147283
PMC,SGPMC648_200 Tôn Đức Thắng,"200 Tôn Đức Thắng, Phường Phú Thủy, Thành phố Phan Thiết, Tỉnh Bình Thuận",10.9335165,108.1112766
PMC,SGPMC268_65B CMT8,"65B CMT8, Phường An Hòa, Quận Ninh Kiều, Thành phố Cần Thơ",10.0498595,105.7755048
PMC,SGPMC848_117A-117B Cách Mạng Tháng Tám,"117A-117B Cách Mạng Tháng Tám, Phường An Thới, Quận Bình Thuỷ, Thành phố Cần Thơ",10.069208,105.75622
PMC,SGPMC786_19/68 Đường 643 - Xa lộ Hà Nội,"19/68 Đường 643 - Xa lộ Hà Nội, Phường Long Bình, Thành phố Biên Hòa, Tỉnh Đồng Nai",10.9530990035,106.8783304553
PMC,SGPMC694_2 An Phú,"2 An Phú, Phường An Phú, Quận 2, Thành phố Hồ Chí Minh",10.8055342286,106.7525827058
PMC,SGPMC980_373/154 Lý Thường Kiệt,"373/154 Lý Thường Kiệt, Phường 08, Quận Tân Bình, Thành phố Hồ Chí Minh",10.7794384,106.6517272
PMC,SGPMC586_1906 - 1908 Quốc lộ 51,"1906 - 1908 Quốc lộ 51, Xã Phước Thái, Huyện Long Thành, Tỉnh Đồng Nai",10.6777771,107.0277929
PMC,SGPMC148_102 Vườn Lài,"102 Vườn Lài, Phường Tân Thành, Quận Tân Phú, Thành phố Hồ Chí Minh",10.7881043,106.6313032
PMC,SGPMC547_0397/1B Vườn Lài,"0397/1B Vườn Lài, Phường An Phú Đông, Quận 12, Thành phố Hồ Chí Minh",10.8576227864,106.6924369522
PMC,SGPMC697_150 Thủ Khoa Huân,"150 Thủ Khoa Huân, Phường Bình Hưng, Thành phố Phan Thiết, Tỉnh Bình Thuận",10.9326947101,108.1088629979
PMC,SGPMC110_1661 Tỉnh Lộ 10,"1661 Tỉnh Lộ 10, Phường Tân Tạo A, Quận Bình Tân, Thành phố Hồ Chí Minh",10.7589519,106.5781271
PMC,SGPMC354_165 Trương Định,"165 Trương Định, Phường Tân Mai, Thành phố Biên Hòa, Tỉnh Đồng Nai",10.9594765844,106.8478151123
PMC,SGPMC838_129 Trần Hưng Đạo,"129 Trần Hưng Đạo, Phường Phú Thủy, Thành phố Phan Thiết, Tỉnh Bình Thuận",10.9374799,108.1036952
PMC,SGPMC1744_Số 1 S08 Tại Tầng 1,"Số 1 S08 Tại Tầng 1, Phường Long Bình, Quận Thủ Đức, Thành phố Hồ Chí Minh",10.8463175029,106.8411180879
PMC,DNPMC1086_AI+AII Nguyễn Văn Trỗi,"AI+AII Nguyễn Văn Trỗi, Phường Tân Thạnh, Thành phố Tam Kỳ, Tỉnh Quảng Nam",15.5837399553,108.4687585984
PMC,DNPMC1111_69 Mai Thúc Loan,"69 Mai Thúc Loan, Phường Đông Ba, Thành phố Huế, Tỉnh Thừa Thiên Huế",16.4766310656,107.5824573043
PMC,DNPMC410_442 Điện Biên Phủ,"442 Điện Biên Phủ, Phường Thanh Khê Đông, Quận Thanh Khê, Thành phố Đà Nẵng",16.0661546,108.1885363
PMC,DNPMC1561_Số 91 Nguyễn Thị Minh Khai,"Số 91 Nguyễn Thị Minh Khai, Phường Cẩm Phô, Thành phố Hội An, Tỉnh Quảng Nam",15.8785131775,108.3231766449
PMC,DNPMC709_89 Nguyễn Thị Định,"89 Nguyễn Thị Định, Phường An Hải Bắc, Quận Sơn Trà, Thành phố Đà Nẵng",16.0816441,108.23157
PMC,DNPMC296_131A Lý Thái Tổ,"131A Lý Thái Tổ, Phường Thạc Gián, Quận Thanh Khê, Thành phố Đà Nẵng",16.0661607,108.2066458
PMC,HNPMC1065_315 Lê Quý Đôn,"315 Lê Quý Đôn, Phường Bồ Xuyên, Thành phố Thái Bình, Tỉnh Thái Bình",20.4508603,106.3412352
PMC,HNPMC1254_L11/LK1 dự án khu dân cư tổ 39,"L11/LK1 dự án khu dân cư tổ 39, Phường Quang Trung, Thành phố Thái Bình, Tỉnh Thái Bình",20.4377754674,106.3239589154
PMC,HNPMC1616_Căn 0101-CT2B & 0102-CT2B,"Căn 0101-CT2B & 0102-CT2B, Phường Thượng Thanh, Quận Long Biên, Thành phố Hà Nội",21.056659962,105.8844914209
PMC,HNPMC1592_Số 176 Nguyễn Huy Tưởng,"Số 176 Nguyễn Huy Tưởng, Phường Thanh Xuân Trung, Quận Thanh Xuân, Thành phố Hà Nội",20.9972956051,105.8036541206
PMC,HNPMC1649_Số 215 Phố Xốm,"Số 215 Phố Xốm, Phường Phú Lương, Quận Hà Đông, Thành phố Hà Nội",20.9421998456,105.7569008685
PMC,HNPMC1679_Số 78 Đường Hà Huy Tập,"Số 78 Đường Hà Huy Tập, Phường Hà Huy Tập, Thành phố Vinh, Tỉnh Nghệ An",18.6903394427,105.6795216498
PMC,HNPMC1680_133 Đường Tô Hiệu,"133 Đường Tô Hiệu, Phường Hà Cầu, Quận Hà Đông, Thành phố Hà Nội",20.9660900214,105.7768115535
PMC,HNPMC1719_Số 293 295 Phố Khương Trung,"Số 293 295 Phố Khương Trung, Phường Khương Trung, Quận Thanh Xuân, Thành phố Hà Nội",20.9940417867,105.8172536118
PMC,HNPMC1727_Số 92 Phố Bạch Mai,"Số 92 Phố Bạch Mai, Phường Bách Khoa, Quận Hai Bà Trưng, Thành phố Hà Nội",21.0067113454,105.8513082707
PMC,HNPMC464_193 Nguyễn Ngọc Vũ,"193 Nguyễn Ngọc Vũ, Phường Trung Hoà, Quận Cầu Giấy, Thành phố Hà Nội",21.0130039,105.8067566
PMC,HNPMC468_267 Lạc Long Quân,"267 Lạc Long Quân, Phường Nghĩa Đô, Quận Cầu Giấy, Thành phố Hà Nội",21.0548826391,105.8089141581
PMC,HNPMC775_Số 1S11 Tầng 1 Tòa nhà số S2.2 (L27M),"Số 1S11 Tầng 1 Tòa nhà số S2.2 (L27M), Xã Đa Tốn, Huyện Gia Lâm, Thành phố Hà Nội",20.991534,105.940558
PMC,HNPMC742_94A Hoàng Như Tiếp,"94A Hoàng Như Tiếp, Phường Bồ Đề, Quận Long Biên, Thành phố Hà Nội",21.0424488525,105.8762685237
PMC,HNPMC825_85 Thạch Bàn,"85 Thạch Bàn, Phường Thạch Bàn, Quận Long Biên, Thành phố Hà Nội",21.0257877622,105.9092822821
PMC,HNPMC867_Sàn Thương mại SO-23C nhà R4,"Sàn Thương mại SO-23C nhà R4, Phường Thượng Đình, Quận Thanh Xuân, Thành phố Hà Nội",21.0031123655,105.8165125892
PMC,HNPMC992_Số 663 Lê Lợi,"Số 663 Lê Lợi, Phường Dĩnh Kế, Thành phố Bắc Giang, Tỉnh Bắc Giang",21.2826096,106.216634
PMC,SGPMC046_19 Hải Triều ,"19 Hải Triều , Phường Bến Nghé, Quận 1, Thành phố Hồ Chí Minh",10.7718812545,106.7048755231
PMC,SGPMC051_339 Nguyễn Thái Bình ,"339 Nguyễn Thái Bình , Phường 12, Quận Tân Bình, Thành phố Hồ Chí Minh",10.796446,106.652455
PMC,SGPMC079_124 Xóm Chiếu,"124 Xóm Chiếu, Phường 14, Quận 4, Thành phố Hồ Chí Minh",10.757978,106.71033
PMC,SGPMC104_66 Phạm Phú Thứ,"66 Phạm Phú Thứ, Phường 03, Quận 6, Thành phố Hồ Chí Minh",10.7425446,106.6450385
PMC,SGPMC103_64 Cống Lỡ,"64 Cống Lỡ, Phường 15, Quận Tân Bình, Thành phố Hồ Chí Minh",10.826199,106.634667
PMC,SGPMC1061_65 Lê Thánh Tông,"65 Lê Thánh Tông, Phường Thắng Lợi, Thành phố Buôn Ma Thuột, Tỉnh Đắk Lắk",12.6853392279,108.0490740513
PMC,SGPMC113_151 Đường Mồi,"151 Đường Mồi, Phường Dĩ An, Thị xã Dĩ An, Tỉnh Bình Dương",10.9032982,106.7556835
PMC,SGPMC1163_309 - 311 Lê Hồng Phong,"309 - 311 Lê Hồng Phong, Phường 3, Thành phố Sóc Trăng, Tỉnh Sóc Trăng",9.5917927652,105.9747883958
PMC,SGPMC1116_14A A Ma Khê,"14A A Ma Khê, Phường Tự An, Thành phố Buôn Ma Thuột, Tỉnh Đắk Lắk",12.6870204105,108.0570818957
PMC,SGPMC1181_Shophouse AS1,"Shophouse AS1, Phường Tân Thới Nhất, Quận 12, Thành phố Hồ Chí Minh",10.830266308,106.618931098
PMC,SGPMC1198_526 Quốc Lộ 62,"526 Quốc Lộ 62, Phường 6, Thành phố Tân An, Tỉnh Long An",10.5454055253,106.3851771465
PMC,SGPMC1287_318 Quốc Lộ 1,"318 Quốc Lộ 1, Phường 5, Thành phố Tân An, Tỉnh Long An",10.56124854,106.4189834507
PMC,SGPMC1279_02 Quách Văn Tuấn,"02 Quách Văn Tuấn, Phường 12, Quận Tân Bình, Thành phố Hồ Chí Minh",10.8008461,106.6526589
PMC,SGPMC156_196-198 Lạc Long Quân,"196-198 Lạc Long Quân, Phường 10, Quận 11, Thành phố Hồ Chí Minh",10.7617065,106.6421834
PMC,SGPMC1604_726 Võ Thị Sáu,"726 Võ Thị Sáu, Thị trấn Long Hải, Huyện Long Điền, Tỉnh Bà Rịa - Vũng Tàu",10.3957569612,107.2295970518
PMC,SGPMC1634_1867 Huỳnh Tấn Phát,"1867 Huỳnh Tấn Phát, Thị trấn Nhà Bè, Huyện Nhà Bè, Thành phố Hồ Chí Minh",10.6997935025,106.7384325432
PMC,SGPMC1671_147 Đường 2 Tháng 9,"147 Đường 2 Tháng 9, Phường 8, Thành phố Vũng Tàu, Tỉnh Bà Rịa - Vũng Tàu",10.3587998106,107.0904118549
PMC,SGPMC1689_270 Lý Thái Tổ,"270 Lý Thái Tổ, Phường 1, Quận 3, Thành phố Hồ Chí Minh",10.7672448487,106.6763783059
PMC,SGPMC192_3 Hồ Thị Kỷ,"3 Hồ Thị Kỷ, Phường 01, Quận 10, Thành phố Hồ Chí Minh",10.76344,106.6775515
PMC,SGPMC188_71 D1,"71 D1, Phường 25, Quận Bình Thạnh, Thành phố Hồ Chí Minh",10.8018128751,106.7189738768
PMC,SGPMC201_382 Đường 30 tháng 4,"382 Đường 30 tháng 4, Phường Hưng Lợi, Quận Ninh Kiều, Thành phố Cần Thơ",10.0215899,105.7705869
PMC,SGPMC226_160 Phạm Văn Chiêu,"160 Phạm Văn Chiêu, Phường 9, Quận Gò Vấp, Thành phố Hồ Chí Minh",10.8475575343,106.6467719529
PMC,SGPMC242_193 Thạch Lam,"193 Thạch Lam, Phường Phú Thạnh, Quận Tân Phú, Thành phố Hồ Chí Minh",10.7778398,106.6276181
PMC,SGPMC309_219 Nguyễn Hữu Cảnh,"219 Nguyễn Hữu Cảnh, Phường Thắng Nhất, Thành phố Vũng Tàu, Tỉnh Bà Rịa - Vũng Tàu",10.3856031,107.1082727
PMC,SGPMC254_48-50 Lý Thường Kiệt,"48-50 Lý Thường Kiệt, Phường 1, Thành phố Vũng Tàu, Tỉnh Bà Rịa - Vũng Tàu",10.348633,107.077025
PMC,SGPMC327_PH-12,"PH-12, Phường 06, Quận 8, Thành phố Hồ Chí Minh",10.7336366,106.6538547
PMC,SGPMC360_8/5 - 8/5B Học Lạc,"8/5 - 8/5B Học Lạc, Phường 8, Thành phố Mỹ Tho, Tỉnh Tiền Giang",10.3565711,106.3758163
PMC,SGPMC413_34 Vũ Tùng,"34 Vũ Tùng, Phường 02, Quận Bình Thạnh, Thành phố Hồ Chí Minh",10.8015713146,106.7002112756
PMC,SGPMC372_42 Ấp Bắc,"42 Ấp Bắc, Phường 10, Thành phố Mỹ Tho, Tỉnh Tiền Giang",10.3739183,106.3466937
PMC,SGPMC420_242 - 244 Lê Lâm,"242 - 244 Lê Lâm, Phường Phú Thạnh, Quận Tân Phú, Thành phố Hồ Chí Minh",10.7822158,106.6206951
PMC,SGPMC425_1018 Lê Văn Lương,"1018 Lê Văn Lương, Xã Phước Kiển, Huyện Nhà Bè, Thành phố Hồ Chí Minh",10.7100303,106.7021977
PMC,SGPMC481_167I Nguyễn Văn Cừ,"167I Nguyễn Văn Cừ, Phường An Khánh, Quận Ninh Kiều, Thành phố Cần Thơ",10.0356071294,105.757126345
PMC,SGPMC482_123 Đề Thám,"123 Đề Thám, Phường An Cư, Quận Ninh Kiều, Thành phố Cần Thơ",10.0358919899,105.7806338437
PMC,SGPMC518_363 Nguyễn Thị Kiểu,"363 Nguyễn Thị Kiểu, Phường Tân Thới Hiệp, Quận 12, Thành phố Hồ Chí Minh",10.8700570246,106.6414259186
PMC,SGPMC553_306 Bùi Đình Túy,"306 Bùi Đình Túy, Phường 12, Quận Bình Thạnh, Thành phố Hồ Chí Minh",10.807339,106.6993128
PMC,SGPMC559_1402 Nguyễn Ái Quốc,"1402 Nguyễn Ái Quốc, Phường Tân Phong, Thành phố Biên Hòa, Tỉnh Đồng Nai",10.96404,106.84065
PMC,SGPMC583_380 Lê Hồng Phong,"380 Lê Hồng Phong, Phường Thắng Tam, Thành phố Vũng Tàu, Tỉnh Bà Rịa - Vũng Tàu",10.35256,107.08777
PMC,SGPMC536_76 Lý Tự Trọng,"76 Lý Tự Trọng, Phường An Cư, Quận Ninh Kiều, Thành phố Cần Thơ",10.0352914,105.7788044
PMC,SGPMC612_1 ô 1/6 đường Võ Thị Sáu,"1 ô 1/6 đường Võ Thị Sáu, Thị trấn Phước Hải, Huyện Đất Đỏ, Tỉnh Bà Rịa - Vũng Tàu",10.4199468656,107.2890469665
PMC,SGPMC639_1112 Huỳnh Tấn Phát,"1112 Huỳnh Tấn Phát, Phường Tân Phú, Quận 7, Thành phố Hồ Chí Minh",10.7210949937,106.7363890168
PMC,SGPMC723_235 Trần Thị Cờ,"235 Trần Thị Cờ, Phường Thới An, Quận 12, Thành phố Hồ Chí Minh",10.8824722718,106.650919183
PMC,SGPMC745_99 Nguyễn Duy Dương,"99 Nguyễn Duy Dương, Phường 09, Quận 5, Thành phố Hồ Chí Minh",10.7602032,106.6710304
PMC,SGPMC690_65 đường số 11,"65 đường số 11, Phường Linh Xuân, Quận Thủ Đức, Thành phố Hồ Chí Minh",10.8846602215,106.7679400571
PMC,SGPMC965_125 Đường số 1,"125 Đường số 1, Phường 11, Quận Gò Vấp, Thành phố Hồ Chí Minh",10.8463552918,106.6604454733
PMC,SGPMC858_14/4 Nguyễn Du,"14/4 Nguyễn Du, Phường Bình Hòa, Thị xã Thuận An, Tỉnh Bình Dương",10.9207409159,106.733748805
PMC,SGPMC996_45 Phan Chu Trinh,"45 Phan Chu Trinh, Phường Thắng Lợi, Thành phố Buôn Ma Thuột, Tỉnh Đắk Lắk",12.683613706,108.0456156869
PMC,SGPMC995_352 Phan Bội Châu,"352 Phan Bội Châu, Phường Thống Nhất, Thành phố Buôn Ma Thuột, Tỉnh Đắk Lắk",12.6826378497,108.0328757908
PMC,SGPMC1720_313 Lê Quang Sung,"313 Lê Quang Sung, Phường 9, Quận 6, Thành phố Hồ Chí Minh",10.7514729931,106.642616524
PMC,DNPMC1567_Số 6B Phước Long,"Số 6B Phước Long, Phường Phước Long, Thành phố Nha Trang, Tỉnh Khánh Hòa",12.2117568785,109.1956784205
PMC,DNPMC801_68B Đồng Nai,"68B Đồng Nai, Phường Phước Hải, Thành phố Nha Trang, Tỉnh Khánh Hòa",12.242216,109.1803706
PMC,DNPMC1633_30 Lê Văn Thứ,"30 Lê Văn Thứ, Phường Mân Thái, Quận Sơn Trà, Thành phố Đà Nẵng",16.0852013366,108.2426329144
PMC,HNPMC1015_135 Hoàng Văn Thụ,"135 Hoàng Văn Thụ, Phường Ngô Quyền, Thành phố Bắc Giang, Tỉnh Bắc Giang",21.2770175,106.2003379
PMC,DNPMC1568_64 Quang Trung,"64 Quang Trung, Phường Vạn Thắng, Thành phố Nha Trang, Tỉnh Khánh Hòa",12.2495340891,109.1906083208
PMC,HNPMC1225_KĐT mới Tây Mỗ - Đại Mỗ - Vinhomes Park,"KĐT mới Tây Mỗ - Đại Mỗ - Vinhomes Park, Phường Đại Mỗ, Quận Nam Từ Liêm, Thành phố Hà Nội",21.0085423397,105.7382028967
PMC,HNPMC1160_198A Phố Xã Đàn,"198A Phố Xã Đàn, Phường Phương Liên, Quận Đống Đa, Thành phố Hà Nội",21.011385,105.83727
PMC,HNPMC1572_215 Thiên Đức,"215 Thiên Đức, Phường Vệ An, Thành phố Bắc Ninh, Tỉnh Bắc Ninh",21.1866055,106.0583848
PMC,HNPMC566_72 + 74 Hàng Bông,"72 + 74 Hàng Bông, Phường Hàng Bông, Quận Hoàn Kiếm, Thành phố Hà Nội",21.0302752063,105.8471064717
PMC,HNPMC511_41A Lý Quốc Sư,"41A Lý Quốc Sư, Phường Hàng Trống, Quận Hoàn Kiếm, Thành phố Hà Nội",21.0295937,105.8492287
PMC,HNPMC1677_Số 19 Lạc Trung,"Số 19 Lạc Trung, Phường Vĩnh Tuy, Quận Hai Bà Trưng, Thành phố Hà Nội",21.0029614962,105.8622697707
PMC,HNPMC615_61 Nguyễn Sơn,"61 Nguyễn Sơn, Phường Ngọc Lâm, Quận Long Biên, Thành phố Hà Nội",21.047084069,105.8777560557
PMC,HNPMC683_Xóm 3 Thôn Cổ Điển,"Xóm 3 Thôn Cổ Điển, Xã Hải Bối, Huyện Đông Anh, Thành phố Hà Nội",21.1113216,105.7897682
PMC,HNPMC774_CH01-14 số 27 Đường Gamuda Gardens 2-2,"CH01-14 số 27 Đường Gamuda Gardens 2-2, Phường Trần Phú, Quận Hoàng Mai, Thành phố Hà Nội",20.9707337,105.8788065
PMC,HNPMC284_194 Định Công Thượng,"194 Định Công Thượng, Phường Định Công, Quận Hoàng Mai, Thành phố Hà Nội",20.9847618025,105.8226760405
PMC,HNPMC853_82 phố Ô Cách,"82 phố Ô Cách, Phường Đức Giang, Quận Long Biên, Thành phố Hà Nội",21.0598125216,105.8963571897
PMC,HNPMC896_Số 278 Đằng Hải,"Số 278 Đằng Hải, Phường Đằng Hải, Quận Hải An, Thành phố Hải Phòng",20.8332770225,106.7270099313
PMC,SGPMC054_186 Phan Văn Trị ,"186 Phan Văn Trị , Phường 12, Quận Bình Thạnh, Thành phố Hồ Chí Minh",10.81184625,106.6952820307
PMC,SGPMC037_249 Nguyễn Thiện Thuật,"249 Nguyễn Thiện Thuật, Phường 01, Quận 3, Thành phố Hồ Chí Minh",10.7692699245,106.6782914853
PMC,HNPMC629_261 - 263 Trần Đại Nghĩa,"261 - 263 Trần Đại Nghĩa, Phường Trương Định, Quận Hai Bà Trưng, Thành phố Hà Nội",20.9970704,105.845896
PMC,"SGPMC1024_Tòa nhà HR1-KDC ""Tân Thuận Tây""","Tòa nhà HR1-KDC ""Tân Thuận Tây"", Phường Tân Thuận Tây, Quận 7, Thành phố Hồ Chí Minh",10.7495724,106.7236065
PMC,SGPMC1052_5 Võ Thị Sáu,"5 Võ Thị Sáu, Thị trấn Phước Bửu, Huyện Xuyên Mộc, Tỉnh Bà Rịa - Vũng Tàu",10.5352956965,107.3994610805
PMC,SGPMC1078_015 Quốc Lộ 50,"015 Quốc Lộ 50, Thị trấn Cần Giuộc, Huyện Cần Giuộc, Tỉnh Long An",10.6007705237,106.6645461812
PMC,SGPMC1152_035 Quốc Lộ 91,"035 Quốc Lộ 91, Thị trấn Cái Dầu, Huyện Châu Phú, Tỉnh An Giang",10.5688242,105.2432184
PMC,SGPMC1151_238 Chợ Lớn,"238 Chợ Lớn, Phường 11, Quận 6, Thành phố Hồ Chí Minh",10.7448192,106.6291261
PMC,SGPMC1164_Số 532 Ấp Thị Trấn B,"Số 532 Ấp Thị Trấn B, Thị trấn Hòa Bình, Huyện Hoà Bình, Tỉnh Bạc Liêu",9.2812164221,105.6245607791
PMC,SGPMC1231_1132 Đường Đồng Khởi,"1132 Đường Đồng Khởi, Phường Trảng Dài, Thành phố Biên Hòa, Tỉnh Đồng Nai",10.9848815152,106.8464037291
PMC,SGPMC1153_24 Hưng Đạo Vương,"24 Hưng Đạo Vương, Phường 1, Thành phố Vĩnh Long, Tỉnh Vĩnh Long",10.2535056106,105.973694946
PMC,SGPMC1329_285 Phan Văn Hớn,"285 Phan Văn Hớn, Phường Tân Thới Nhất, Quận 12, Thành phố Hồ Chí Minh",10.8315039,106.6112995
PMC,SGPMC1330_1/62 Nguyễn Văn Quá,"1/62 Nguyễn Văn Quá, Phường Tân Hưng Thuận, Quận 12, Thành phố Hồ Chí Minh",10.8300251,106.6269987
PMC,SGPMC1590_46 Trần Hưng Đạo,"46 Trần Hưng Đạo, Phường Phước Hội, Thị xã La Gi, Tỉnh Bình Thuận",10.6588565216,107.7742739574
PMC,SGPMC1632_CH S1.0.04,"CH S1.0.04, Phường Sơn Kỳ, Quận Tân Phú, Thành phố Hồ Chí Minh",10.8038378516,106.6170420299
PMC,DNPMC388_15A Hai Bà Trưng,"15A Hai Bà Trưng, Phường Vĩnh Ninh, Thành phố Huế, Tỉnh Thừa Thiên Huế",16.4617208483,107.5894906779
PMC,SGPMC1678_664 Đường Ba Tháng Hai,"664 Đường Ba Tháng Hai, Phường 14, Quận 10, Thành phố Hồ Chí Minh",10.7647497777,106.6614483783
PMC,SGPMC1639_1046 Cách Mạng Tháng Tám,"1046 Cách Mạng Tháng Tám, Phường 4, Thành phố Tây Ninh, Tỉnh Tây Ninh",11.3063994538,106.1258014825
PMC,SGPMC1631_1191 CMT8,"1191 CMT8, Phường Hiệp Ninh, Thành phố Tây Ninh, Tỉnh Tây Ninh",11.3050769304,106.1292938417
PMC,SGPMC179_1127 Nguyễn Ảnh Thủ,"1127 Nguyễn Ảnh Thủ, Phường Trung Mỹ Tây, Quận 12, Thành phố Hồ Chí Minh",10.866146,106.614745
PMC,SGPMC199_312A/9 Nguyễn Văn Linh,"312A/9 Nguyễn Văn Linh, Phường An Khánh, Quận Ninh Kiều, Thành phố Cần Thơ",10.0288225,105.7541256
PMC,SGPMC1732_178B Tân Hòa Đông,"178B Tân Hòa Đông, Phường 14, Quận 6, Thành phố Hồ Chí Minh",10.7598740848,106.6258693863
PMC,SGPMC212_EA2-01-01A tầng trệt Khối A2 - dự án khu Tái Định Cư Phú Mỹ - The Era Town,"EA2-01-01A tầng trệt Khối A2 - dự án khu Tái Định Cư Phú Mỹ - The Era Town, Phường Phú Mỹ, Quận 7, Thành phố Hồ Chí Minh",10.699858,106.732268
PMC,SGPMC234_60 - 62 Trương Công Định,"60 - 62 Trương Công Định, Phường 14, Quận Tân Bình, Thành phố Hồ Chí Minh",10.79692,106.641197
PMC,SGPMC231_Cửa Hàng Xăng Dầu số 35 - 70 Trương Định,"Cửa Hàng Xăng Dầu số 35 - 70 Trương Định, Phường 07, Quận 3, Thành phố Hồ Chí Minh",10.7824331022,106.6837123027
PMC,SGPMC216_1A Lương Thế Vinh,"1A Lương Thế Vinh, Phường 9, Thành phố Vũng Tàu, Tỉnh Bà Rịa - Vũng Tàu",10.3704463,107.0875177
PMC,SGPMC210_568 Hà Huy Giáp,"568 Hà Huy Giáp, Phường Thạnh Lộc, Quận 12, Thành phố Hồ Chí Minh",10.8824764,106.6799172
PMC,SGPMC322_414 Trương Công Định ,"414 Trương Công Định , Phường 8, Thành phố Vũng Tàu, Tỉnh Bà Rịa - Vũng Tàu",10.3601869,107.0874766
PMC,SGPMC253_622A Kha Vạn Cân,"622A Kha Vạn Cân, Phường Linh Đông, Quận Thủ Đức, Thành phố Hồ Chí Minh",10.8409700894,106.7458969223
PMC,SGPMC361_77/7 - 78/1 Lê Thị Hồng Gấm,"77/7 - 78/1 Lê Thị Hồng Gấm, Phường 6, Thành phố Mỹ Tho, Tỉnh Tiền Giang",10.3526309,106.3552292
PMC,SGPMC387_201A đường Bờ Bao Tân Thắng,"201A đường Bờ Bao Tân Thắng, Phường Sơn Kỳ, Quận Tân Phú, Thành phố Hồ Chí Minh",10.7994964,106.6133671
PMC,SGPMC406_66 Tây Hòa,"66 Tây Hòa, Phường Phước Long A, Quận 9, Thành phố Hồ Chí Minh",10.8261043417,106.7640089976
PMC,SGPMC585_Thửa đất số 238 - Tờ bản đồ số 13 - Quốc Lộ 51,"Thửa đất số 238 - Tờ bản đồ số 13 - Quốc Lộ 51, Xã Tân Phước, Thị xã Phú Mỹ, Tỉnh Bà Rịa - Vũng Tàu",10.5624308,107.0610882
PMC,SGPMC545_403 Lý Thường Kiệt,"403 Lý Thường Kiệt, Phường Dĩ An, Thị xã Dĩ An, Tỉnh Bình Dương",10.9081866317,106.7516061146
PMC,SGPMC722_15 Dương Đình Nghệ,"15 Dương Đình Nghệ, Phường 08, Quận 11, Thành phố Hồ Chí Minh",10.7609518,106.6497518
PMC,SGPMC978_364 Đường 30 tháng 4,"364 Đường 30 tháng 4, Phường 3, Thành phố Tây Ninh, Tỉnh Tây Ninh",11.3159846058,106.0980089789
PMC,SGPMC532_112 Bùi Văn Hoà,"112 Bùi Văn Hoà, Phường An Bình, Thành phố Biên Hòa, Tỉnh Đồng Nai",10.9291357,106.8772952
PMC,DNPMC1059_360 Trần Cao Vân,"360 Trần Cao Vân, Phường Trường Xuân, Thành phố Tam Kỳ, Tỉnh Quảng Nam",15.5543146,108.4854381
PMC,DNPMC1246_45 Hồ Quý Ly,"45 Hồ Quý Ly, Phường Hòa Minh, Quận Liên Chiểu, Thành phố Đà Nẵng",16.0750380345,108.1715639961
PMC,DNPMC1297_754 Đường 2/4,"754 Đường 2/4, Phường Vĩnh Phước, Thành phố Nha Trang, Tỉnh Khánh Hòa",12.269037224,109.1972601068
PMC,DNPMC1585_154 Hùng Vương,"154 Hùng Vương, Phường Lộc Thọ, Thành phố Nha Trang, Tỉnh Khánh Hòa",12.2347732927,109.1958870763
PMC,HNPMC1161_Số 8T1 Tòa nhà Rainbow Linh Đàm,"Số 8T1 Tòa nhà Rainbow Linh Đàm, Phường Hoàng Liệt, Quận Hoàng Mai, Thành phố Hà Nội",20.9634946188,105.8243986786
PMC,HNPMC1226_23 Tôn Đức Thắng,"23 Tôn Đức Thắng, Phường Khai Quang, Thành phố Vĩnh Yên, Tỉnh Vĩnh Phúc",21.3139768,105.6163411
PMC,DNPMC1608_76 Lê Văn Hiến,"76 Lê Văn Hiến, Phường Khuê Mỹ, Quận Ngũ Hành Sơn, Thành phố Đà Nẵng",16.0348758102,108.2445570455
PMC,DNPMC647_65 Lý Thái Tông,"65 Lý Thái Tông, Phường Thanh Khê Tây, Quận Thanh Khê, Thành phố Đà Nẵng",16.074173,108.1753183
PMC,DNPMC491_41 Mai Hắc Đế,"41 Mai Hắc Đế, Phường An Hải Tây, Quận Sơn Trà, Thành phố Đà Nẵng",16.064997,108.231379
PMC,HNPMC1597_1S16,"1S16, Phường Mễ Trì, Quận Nam Từ Liêm, Thành phố Hà Nội",21.011420015,105.7852799322
PMC,HNPMC1607_KNP Sol Forest TT-PT3B,"KNP Sol Forest TT-PT3B, Xã Xuân Quan, Huyện Văn Giang, Tỉnh Hưng Yên",20.9612264453,105.9206195374
PMC,HNPMC1623_Ki ốt số 10 và số 12,"Ki ốt số 10 và số 12, Xã Cự Khê, Huyện Thanh Oai, Thành phố Hà Nội",20.9311592116,105.7839561772
PMC,HNPMC480_55 Phố Hoàng Văn Thái,"55 Phố Hoàng Văn Thái, Phường Khương Mai, Quận Thanh Xuân, Thành phố Hà Nội",20.9963414725,105.8282379248
PMC,HNPMC564_139 Khương Thượng,"139 Khương Thượng, Phường Khương Thượng, Quận Đống Đa, Thành phố Hà Nội",21.0041134469,105.8258431364
PMC,HNPMC652_5A Phố Láng Hạ,"5A Phố Láng Hạ, Phường Thành Công, Quận Ba Đình, Thành phố Hà Nội",21.022121,105.81918
PMC,HNPMC1564_STMDV-03 Khu STM Tecco Skyville Tower ,"STMDV-03 Khu STM Tecco Skyville Tower , , Huyện Thanh Trì, Thành phố Hà Nội",20.9325655,105.850273
PMC,HNPMC569_Tòa nhà T3A-Horizon Tower,"Tòa nhà T3A-Horizon Tower, Phường Xuân Tảo, Quận Bắc Từ Liêm, Thành phố Hà Nội",21.0647807,105.7985876
PMC,HNPMC672_70 Văn Cao,"70 Văn Cao, Phường Đằng Giang, Quận Ngô Quyền, Thành phố Hải Phòng",20.8387084,106.7001875
PMC,HNPMC684_63 Nguyên Hồng,"63 Nguyên Hồng, Phường Láng Hạ, Quận Đống Đa, Thành phố Hà Nội",21.016819,105.8110226
PMC,SGPMC039_76 Đường số 1 ,"76 Đường số 1 , Phường Bình Trị Đông B, Quận Bình Tân, Thành phố Hồ Chí Minh",10.74852788,106.61835712
PMC,HNPMC974_301-303 Nguyễn Thị Lưu II,"301-303 Nguyễn Thị Lưu II, Phường Ngô Quyền, Thành phố Bắc Giang, Tỉnh Bắc Giang",21.2836504415,106.2031644638
PMC,SGPMC094_65A Lã Xuân Oai,"65A Lã Xuân Oai, Phường Tăng Nhơn Phú A, Quận 9, Thành phố Hồ Chí Minh",10.842874,106.789834
