MARKER_ID,SHOP_NAME,SHOP_ADDRESS,LATITUDE,LONGITUDE
PMC,SGPMC1014_102 Võ Thị Sáu,"102 Võ Thị Sáu, Phường 4, Thành phố Tây Ninh, Tỉnh Tây Ninh",11.3004805,106.1073936
PMC,SGPMC1049_157 Trần Quý Cáp,"157 Trần Quý Cáp, Phường Tự An, Thành phố Buôn Ma Thuột, Tỉnh Đắk Lắk",12.6661902,108.0555217
PMC,SGPMC1105_160 Nguyễn Việt Hồng,"160 Nguyễn Việt Hồng, Phường An Phú, Quận Ninh Kiều, Thành phố Cần Thơ",10.0304886,105.7767786
PMC,SGPMC1051_71 Trần Văn Xã,"71 Trần Văn Xã, Phường Trảng Dài, Thành phố Biên Hòa, Tỉnh Đồng Nai",10.9834369975,106.8608983104
PMC,SGPMC114_ 98 An Bình," 98 An Bình, Phường An Bình, Thị xã Dĩ An, Tỉnh Bình Dương",10.8703939,106.7557499
PMC,SGPMC130_628 Xô Viết Nghệ Tĩnh,"628 Xô Viết Nghệ Tĩnh, Phường 25, Quận Bình Thạnh, Thành phố Hồ Chí Minh",10.8116235,106.7146397
PMC,SGPMC1558_Căn hộ chung cư số 1016/27,"Căn hộ chung cư số 1016/27, Phường Tân Phong, Quận 7, Thành phố Hồ Chí Minh",10.7327761213,106.7059423771
PMC,SGPMC1626_CH A0.04,"CH A0.04, Phường Cát Lái, Quận 2, Thành phố Hồ Chí Minh",10.7707156103,106.7875615771
PMC,SGPMC1661_403 Hùng Vương,"403 Hùng Vương, Phường An Bình, Thị Xã Buôn Hồ, Tỉnh Đắk Lắk",12.918935231,108.2647832614
PMC,SGPMC1659_30A1/A11,"30A1/A11, Phường An Phú, Thị xã Thuận An, Tỉnh Bình Dương",10.9370973101,106.7446450611
PMC,SGPMC183_204 Gò Xoài,"204 Gò Xoài, Phường Bình Hưng Hoà A, Quận Bình Tân, Thành phố Hồ Chí Minh",10.7867818,106.6048602
PMC,SGPMC180_45 Lâm Văn Bền,"45 Lâm Văn Bền, Phường Tân Thuận Tây, Quận 7, Thành phố Hồ Chí Minh",10.7489557,106.7157645
PMC,SGPMC193_8 Đường 40,"8 Đường 40, Phường Tân Tạo, Quận Bình Tân, Thành phố Hồ Chí Minh",10.7523348,106.6042181
PMC,SGPMC213_103 Đường số 15,"103 Đường số 15, Phường Tân Quy, Quận 7, Thành phố Hồ Chí Minh",10.7454439,106.7064184
PMC,SGPMC1722_17T1-S6 6 Khu Nhà Ở Cao Tầng Dự Án Khu Dân Cư Và Công Vi,"17T1-S6 6 Khu Nhà Ở Cao Tầng Dự Án Khu Dân Cư Và Công Vi, Phường Long Bình, Quận Thủ Đức, Thành phố Hồ Chí Minh",10.8430228941,106.8389426452
PMC,SGPMC204_391 - 393 Phan Huy Ích,"391 - 393 Phan Huy Ích, Phường 14, Quận Gò Vấp, Thành phố Hồ Chí Minh",10.8415345,106.6383788
PMC,SGPMC214_715 Tỉnh lộ 10,"715 Tỉnh lộ 10, Phường Bình Trị Đông B, Quận Bình Tân, Thành phố Hồ Chí Minh",10.7579389,106.6113697
PMC,SGPMC222_81A Ngô Quyền,"81A Ngô Quyền, Phường 06, Quận 10, Thành phố Hồ Chí Minh",10.7620391,106.6649345
PMC,SGPMC245_Số 43 đường Tỉnh lộ 8,"Số 43 đường Tỉnh lộ 8, Xã Tân Thạnh Tây, Huyện Củ Chi, Thành phố Hồ Chí Minh",10.9835529,106.5745691
PMC,SGPMC319_Lô TM 1.02 Tầng 1 Chung cư River Gate 151-155 Bến Vân Đồn,"Lô TM 1.02 Tầng 1 Chung cư River Gate 151-155 Bến Vân Đồn, Phường 06, Quận 4, Thành phố Hồ Chí Minh",10.7628146198,106.6989158907
PMC,SGPMC331_650 đường Nguyễn Ái Quốc,"650 đường Nguyễn Ái Quốc, Phường Hố Nai, Thành phố Biên Hòa, Tỉnh Đồng Nai",10.9720396045,106.8733759904
PMC,SGPMC389_92 - 94 Châu Thị Kim,"92 - 94 Châu Thị Kim, Phường 3, Thành phố Tân An, Tỉnh Long An",10.5306774,106.4170947
PMC,SGPMC509_38 Đường số 2,"38 Đường số 2, Phường Trường Thọ, Quận Thủ Đức, Thành phố Hồ Chí Minh",10.8342980597,106.7556264313
PMC,SGPMC506_189A Ung Văn Khiêm,"189A Ung Văn Khiêm, Phường Mỹ Phước, Thành phố Long Xuyên, Tỉnh An Giang",10.370632,105.4362775
PMC,SGPMC525_1094 Trần Hưng Đạo,"1094 Trần Hưng Đạo, Phường Mỹ Bình, Thành phố Long Xuyên, Tỉnh An Giang",10.3871741445,105.4334900215
PMC,SGPMC561_36 Đường D2,"36 Đường D2, Phường Bửu Long, Thành phố Biên Hòa, Tỉnh Đồng Nai",10.9564,106.80676
PMC,SGPMC563_80 Tôn Thất Tùng,"80 Tôn Thất Tùng, Phường Bến Thành, Quận 1, Thành phố Hồ Chí Minh",10.7699485,106.6887286
PMC,SGPMC587_372 Quốc lộ 51,"372 Quốc lộ 51, Xã Phước Bình, Huyện Long Thành, Tỉnh Đồng Nai",10.6560595185,107.0382470279
PMC,SGPMC710_C13/49 Ấp 3,"C13/49 Ấp 3, Xã Bình Chánh, Huyện Bình Chánh, Thành phố Hồ Chí Minh",10.6616935972,106.5747830071
PMC,SGPMC693_640 Lê Văn Lương,"640 Lê Văn Lương, Phường Tân Phong, Quận 7, Thành phố Hồ Chí Minh",10.7326232616,106.7012437841
PMC,SGPMC575_28 Đặng Văn Trơn,"28 Đặng Văn Trơn, Xã Hiệp Hòa, Thành phố Biên Hòa, Tỉnh Đồng Nai",10.9340794,106.8301063
PMC,SGPMC712_37-39 Bùi Hữu Nghĩa,"37-39 Bùi Hữu Nghĩa, Phường Tân Vạn, Thành phố Biên Hòa, Tỉnh Đồng Nai",10.9079074,106.8293267
PMC,SGPMC721_7 Ngô Gia Tự,"7 Ngô Gia Tự, Xã Trung An, Thành phố Mỹ Tho, Tỉnh Tiền Giang",10.3415289412,106.3124298706
PMC,SGPMC789_I1 Đường Đồng Khởi,"I1 Đường Đồng Khởi, Phường Tân Hiệp, Thành phố Biên Hòa, Tỉnh Đồng Nai",10.9545029,106.8682038
PMC,SGPMC807_600 Quang Trung,"600 Quang Trung, Phường 11, Quận Gò Vấp, Thành phố Hồ Chí Minh",10.8354891138,106.6615631339
PMC,SGPMC869_155 Đường số 154,"155 Đường số 154, Phường Tân Phú, Quận 9, Thành phố Hồ Chí Minh",10.8671368703,106.8094130239
PMC,SGPMC885_32 Nguyễn Văn Trỗi,"32 Nguyễn Văn Trỗi, Phường 15, Quận Phú Nhuận, Thành phố Hồ Chí Minh",10.7933323,106.6801178
PMC,VTBHUB513_2A Đinh Tiên Hoàng,"2A Đinh Tiên Hoàng, Phường Lộc Thọ, Thành phố Nha Trang, Tỉnh Khánh Hòa",12.2477743,109.1921206
PMC,SGPMC972_192 Đống Đa,"192 Đống Đa, Phường Vĩnh Lạc, Thành phố Rạch Giá, Tỉnh Kiên Giang",9.9924293,105.0914751
PMC,SGPMC1645_818 Hậu Giang,"818 Hậu Giang, Phường 12, Quận 6, Thành phố Hồ Chí Minh",10.7468949349,106.6303618146
PMC,SGPMC404_365 Phạm Thế Hiển,"365 Phạm Thế Hiển, Phường 03, Quận 8, Thành phố Hồ Chí Minh",10.7481817873,106.6816714802
PMC,SGPMC924_Lô C24 Ngô Quyền,"Lô C24 Ngô Quyền, Phường Vĩnh Lạc, Thành phố Rạch Giá, Tỉnh Kiên Giang",10.0004454,105.093552
PMC,HNPMC1749_161 Phố Lò Đúc,"161 Phố Lò Đúc, , , ",21.0102826529,105.8601952515
PMC,DNPMC1008_238 Văn Tiến Dũng,"238 Văn Tiến Dũng, Phường Hòa Xuân, Quận Cẩm Lệ, Thành phố Đà Nẵng",15.9952414868,108.2133700363
PMC,DNPMC1056_59 Nguyễn Đức Cảnh,"59 Nguyễn Đức Cảnh, Phường Phước Long, Thành phố Nha Trang, Tỉnh Khánh Hòa",12.2177551,109.195186
PMC,DNPMC1285_22-24 Điện Biên Phủ,"22-24 Điện Biên Phủ, Phường Vĩnh Hòa, Thành phố Nha Trang, Tỉnh Khánh Hòa",12.288515,109.203456
PMC,DNPMC1368_298 Lý Thường Kiệt,"298 Lý Thường Kiệt, Phường Tân An, Thành phố Hội An, Tỉnh Quảng Nam",15.8832446,108.328375
PMC,DNPMC1030_11B Lạc Long Quân,"11B Lạc Long Quân, Phường Phước Tân, Thành phố Nha Trang, Tỉnh Khánh Hòa",12.2442907,109.1852678
PMC,DNPMC297_189 Nguyễn Văn Thoại,"189 Nguyễn Văn Thoại, Phường An Hải Đông, Quận Sơn Trà, Thành phố Đà Nẵng",16.0554419411,108.2429509052
PMC,DNPMC1726_Lô 1138 -B2 33 KDT Xanh Bàu Tràm Lakeside,"Lô 1138 -B2 33 KDT Xanh Bàu Tràm Lakeside, Phường Hòa Hiệp Nam, Quận Liên Chiểu, Thành phố Đà Nẵng",16.0992913,108.1299612
PMC,DNPMC815_119 Mai Am,"119 Mai Am, Phường Thuận Phước, Quận Hải Châu, Thành phố Đà Nẵng",16.0832070145,108.2169346964
PMC,HNPMC1012_Số nhà 01-ngõ 01-Phạm Tuấn Tài-Phường Dịch Vọng Hậu,"Số nhà 01-ngõ 01-Phạm Tuấn Tài-Phường Dịch Vọng Hậu, Phường Dịch Vọng Hậu, Quận Cầu Giấy, Thành phố Hà Nội",21.0426218,105.786111
PMC,HNPMC1120_301 Ngô Gia Tự,"301 Ngô Gia Tự, Phường Đằng Lâm, Quận Hải An, Thành phố Hải Phòng",20.8294777664,106.7060661696
PMC,HNPMC1595_1A phố Quốc Tử Giám,"1A phố Quốc Tử Giám, Phường Văn Chương, Quận Đống Đa, Thành phố Hà Nội",21.0259986183,105.8380629704
PMC,HNPMC1629_39 Vạn Phúc,"39 Vạn Phúc, Phường Vạn Phúc, Quận Hà Đông, Thành phố Hà Nội",20.9780155067,105.7750640447
PMC,HNPMC1253_303 Nguyễn Đức Cảnh,"303 Nguyễn Đức Cảnh, Thị trấn Diêm Điền, Huyện Thái Thụy, Tỉnh Thái Bình",20.5627849238,106.5662765591
PMC,HNPMC1686_231 Đường Trần Huy Liệu,"231 Đường Trần Huy Liệu, Phường Văn Miếu, Thành phố Nam Định, Tỉnh Nam Định",20.4180107273,106.1613351866
PMC,HNPMC1673_TT01A-4,"TT01A-4, Phường Mộ Lao, Quận Hà Đông, Thành phố Hà Nội",20.987134094,105.7851956768
PMC,HNPMC496_58 Nguyễn Đức Cảnh,"58 Nguyễn Đức Cảnh, Phường Tương Mai, Quận Hoàng Mai, Thành phố Hà Nội",20.9873897,105.85013
PMC,HNPMC608_Kiot số 01 và 02 Tầng 1 TN 172-CT2 DA Trung Văn,"Kiot số 01 và 02 Tầng 1 TN 172-CT2 DA Trung Văn, Phường Trung Văn, Quận Nam Từ Liêm, Thành phố Hà Nội",20.99423437,105.7777736
PMC,HNPMC628_Kiot 21 T1-Tầng DVTM,"Kiot 21 T1-Tầng DVTM, Phường Phú Lãm, Quận Hà Đông, Thành phố Hà Nội",20.94704719,105.7551401
PMC,HNPMC1713_Số 47 Phố Núi Trúc,"Số 47 Phố Núi Trúc, Phường Giảng Võ, Quận Ba Đình, Thành phố Hà Nội",21.030233,105.822205
PMC,HNPMC638_215 Cổ Nhuế,"215 Cổ Nhuế, Phường Cổ Nhuế 2, Quận Bắc Từ Liêm, Thành phố Hà Nội",21.063354,105.77994
PMC,HNPMC701_81 Hai Bà Trưng,"81 Hai Bà Trưng, Phường An Biên, Quận Lê Chân, Thành phố Hải Phòng",20.8532405356,106.680459428
PMC,HNPMC756_24C An Đà,"24C An Đà, Phường Lạch Tray, Quận Ngô Quyền, Thành phố Hải Phòng",20.843783946,106.6942172735
PMC,HNPMC1684_11 Đường Văn Cao,"11 Đường Văn Cao, Phường Năng Tĩnh, Thành phố Nam Định, Tỉnh Nam Định",20.4201723039,106.1680985265
PMC,HNPMC769_Ô TMDV 03,"Ô TMDV 03, Xã An Khánh, Huyện Hoài Đức, Thành phố Hà Nội",21.0090766,105.7217404
PMC,HNPMC812_222 Trần Duy Hưng,"222 Trần Duy Hưng, Phường Trung Hoà, Quận Cầu Giấy, Thành phố Hà Nội",21.0066609019,105.7934430861
PMC,HNPMC813_53 Trần Quốc Hoàn,"53 Trần Quốc Hoàn, Phường Dịch Vọng Hậu, Quận Cầu Giấy, Thành phố Hà Nội",21.0416437,105.7872904
PMC,HNPMC833_60M phố Phan Bội Châu,"60M phố Phan Bội Châu, Phường Hoàng Văn Thụ, Quận Hồng Bàng, Thành phố Hải Phòng",20.8570243401,106.6788862309
PMC,HNPMC879_Số 1S15A Tầng 1 Tòa nhà Số S6A (S6.1),"Số 1S15A Tầng 1 Tòa nhà Số S6A (S6.1), Phường Phúc Lợi, Quận Long Biên, Thành phố Hà Nội",21.0491354515,105.9182705489
PMC,HNPMC898_64 Bạch Đằng,"64 Bạch Đằng, Thị trấn Núi Đèo, Huyện Thuỷ Nguyên, Thành phố Hải Phòng",20.9197225326,106.6778930314
PMC,NHC_77 Nguyễn Hữu Cầu,"77 Nguyễn Hữu Cầu, Phường Tân Định, Quận 1, Thành phố Hồ Chí Minh",10.790434,106.690873
PMC,SGPMC081_247 Tô Ngọc Vân,"247 Tô Ngọc Vân, Phường Linh Đông, Quận Thủ Đức, Thành phố Hồ Chí Minh",10.85678,106.7499
PMC,SGPMC1045_16 Lê Vĩnh Hòa,"16 Lê Vĩnh Hòa, Phường 8, Thành phố Sóc Trăng, Tỉnh Sóc Trăng",9.60944446,105.9788422217
PMC,SGPMC1023_52 Nguyễn Hội,"52 Nguyễn Hội, Phường Phú Trinh, Thành phố Phan Thiết, Tỉnh Bình Thuận",10.935545443,108.0974155151
PMC,SGPMC109_1227 Phạm Thế Hiển,"1227 Phạm Thế Hiển, Phường 05, Quận 8, Thành phố Hồ Chí Minh",10.741304,106.659272
PMC,SGPMC1262_150 Trần Phú,"150 Trần Phú, Phường An Hoà, Thành phố Sa Đéc, Tỉnh Đồng Tháp",10.2944843917,105.7582970378
PMC,SGPMC1348_109 đường 30/04,"109 đường 30/04, Phường 1, Thành phố Cao Lãnh, Tỉnh Đồng Tháp",10.4622723956,105.629642474
PMC,SGPMC1598_0.05 Lầu Trệt (Thông tầng) Block A1 Chung cư Westgate,"0.05 Lầu Trệt (Thông tầng) Block A1 Chung cư Westgate, Thị trấn Tân Túc, Huyện Bình Chánh, Thành phố Hồ Chí Minh",10.6902623709,106.5865436802
PMC,SGPMC1618_CH số GB.01.08,"CH số GB.01.08, Phường Nguyễn An Ninh, Thành phố Vũng Tàu, Tỉnh Bà Rịa - Vũng Tàu",10.3760340726,107.1127987753
PMC,SGPMC1663_77 Trần Đại Nghĩa,"77 Trần Đại Nghĩa, Phường 4, Thành phố Vĩnh Long, Tỉnh Vĩnh Long",10.2464116278,105.9791787649
PMC,SGPMC175_174G Đặng Văn Ngữ,"174G Đặng Văn Ngữ, Phường 14, Quận Phú Nhuận, Thành phố Hồ Chí Minh",10.7917384879,106.6674345635
PMC,SGPMC1676_Căn TM Số 1.01,"Căn TM Số 1.01, Phường Phú Thuận, Quận 7, Thành phố Hồ Chí Minh",10.7158332158,106.7406954072
PMC,SGPMC189_76H1 Nguyễn Ảnh Thủ,"76H1 Nguyễn Ảnh Thủ, Phường Hiệp Thành, Quận 12, Thành phố Hồ Chí Minh",10.8809797,106.6336031
PMC,SGPMC043_171A Bùi Đình Túy ,"171A Bùi Đình Túy , Phường 24, Quận Bình Thạnh, Thành phố Hồ Chí Minh",10.807778,106.703859
PMC,SGPMC195_739 Cách Mạng Tháng 8,"739 Cách Mạng Tháng 8, Phường 06, Quận Tân Bình, Thành phố Hồ Chí Minh",10.7875624,106.6629162
PMC,SGPMC243_69C Khu phố Hòa Long,"69C Khu phố Hòa Long, Phường Lái Thiêu, Thị xã Thuận An, Tỉnh Bình Dương",10.8851187834,106.7041064511
PMC,SGPMC317_1097B Tỉnh lộ 43,"1097B Tỉnh lộ 43, Phường Bình Chiểu, Quận Thủ Đức, Thành phố Hồ Chí Minh",10.8844488,106.7288392
PMC,SGPMC401_396 Nguyễn Tri Phương,"396 Nguyễn Tri Phương, Phường 04, Quận 10, Thành phố Hồ Chí Minh",10.7645615,106.6678451
PMC,SGPMC376_1242 Kha Vạn Cân,"1242 Kha Vạn Cân, Phường Linh Trung, Quận Thủ Đức, Thành phố Hồ Chí Minh",10.8633878,106.761119
PMC,SGPMC446_15D Nguyễn Thị Minh Khai,"15D Nguyễn Thị Minh Khai, Phường Bến Nghé, Quận 1, Thành phố Hồ Chí Minh",10.7859286165,106.7009338795
PMC,SGPMC433_49 Huỳnh Châu Sổ,"49 Huỳnh Châu Sổ, Thị trấn Bến Lức, Huyện Bến Lức, Tỉnh Long An",10.641140029,106.4821487661
PMC,SGPMC473_Shophouse A1-01 Tầng 1 Chung cư The Golden Star - 58B Nguyễn Thị Thập,"Shophouse A1-01 Tầng 1 Chung cư The Golden Star - 58B Nguyễn Thị Thập, Phường Bình Thuận, Quận 7, Thành phố Hồ Chí Minh",10.7386637,106.7261689
PMC,SGPMC470_38B - 38C Gò Dầu,"38B - 38C Gò Dầu, Phường Tân Quý, Quận Tân Phú, Thành phố Hồ Chí Minh",10.7958268,106.6275285
PMC,SGPMC479_1H9 đường DD12 (Khu Dân Cư An Sương),"1H9 đường DD12 (Khu Dân Cư An Sương), Phường Tân Hưng Thuận, Quận 12, Thành phố Hồ Chí Minh",10.8418094601,106.6267787673
PMC,SGPMC487_01 đường Làng Tăng Phú,"01 đường Làng Tăng Phú, Phường Tăng Nhơn Phú A, Quận 9, Thành phố Hồ Chí Minh",10.840092,106.7973743
PMC,SGPMC578_621 Lý Thường Kiệt,"621 Lý Thường Kiệt, Phường 08, Quận Tân Bình, Thành phố Hồ Chí Minh",10.7894704,106.6521323
PMC,SGPMC595_3K Trần Quang Khải,"3K Trần Quang Khải, Phường An Hòa, Thành phố Rạch Giá, Tỉnh Kiên Giang",9.985339045,105.1040137
PMC,SGPMC601_110 Lý Thường Kiệt,"110 Lý Thường Kiệt, Phường Vĩnh Thanh, Thành phố Rạch Giá, Tỉnh Kiên Giang",10.01226746,105.076945
PMC,SGPMC624_14 Lê Đại Hành,"14 Lê Đại Hành, Phường Hố Nai, Thành phố Biên Hòa, Tỉnh Đồng Nai",10.97205894,106.8843291
PMC,SGPMC696_16 Trần Huy Liệu,"16 Trần Huy Liệu, Phường 12, Quận Phú Nhuận, Thành phố Hồ Chí Minh",10.7916066688,106.6780506566
PMC,SGPMC730_753B Kha Vạn Cân,"753B Kha Vạn Cân, Phường Linh Tây, Quận Thủ Đức, Thành phố Hồ Chí Minh",10.8533378919,106.7546763512
PMC,SGPMC802_Số 138 đường Linh Trung,"Số 138 đường Linh Trung, Phường Linh Trung, Quận Thủ Đức, Thành phố Hồ Chí Minh",10.8604713,106.7732478
PMC,SGPMC805_67 Hoàng Hoa Thám,"67 Hoàng Hoa Thám, Phường 06, Quận Bình Thạnh, Thành phố Hồ Chí Minh",10.8063492443,106.6903048398
PMC,SGPMC987_126 Đường Số 9,"126 Đường Số 9, Phường Dĩ An, Thị xã Dĩ An, Tỉnh Bình Dương",10.8934590072,106.7620606775
PMC,SGPMC870_265/1 Tỉnh lộ 827A,"265/1 Tỉnh lộ 827A, Xã Hòa Phú, Huyện Châu Thành, Tỉnh Long An",10.4902884,106.4246328
PMC,SGPMC988_33 Trương Định,"33 Trương Định, Phường 1, Thị xã Gò Công, Tỉnh Tiền Giang",10.3608062502,106.6740577063
PMC,VTBHUB140_51 Đường số 4 nối dài,"51 Đường số 4 nối dài, Phường An Lạc, Quận Bình Tân, Thành phố Hồ Chí Minh",10.7206976,106.6167442
PMC,SGPMC1701_1072 1074 Cmt8,"1072 1074 Cmt8, Phường 4, Quận Tân Bình, Thành phố Hồ Chí Minh",10.7911064041,106.6570341423
PMC,DNPMC1101_117 Lê Tấn Trung,"117 Lê Tấn Trung, Phường Thọ Quang, Quận Sơn Trà, Thành phố Đà Nẵng",16.0955308,108.2473449
PMC,DNPMC325_108 Ông Ích Đường,"108 Ông Ích Đường, Phường Hòa Thọ Đông, Quận Cẩm Lệ, Thành phố Đà Nẵng",16.0143662,108.2056879
PMC,DNPMC1582_164 Nguyễn Thái Học,"164 Nguyễn Thái Học, Phường Ngô Mây, Thành phố Quy Nhơn, Tỉnh Bình Định",13.7721179686,109.2193457574
PMC,DNPMC304_428-430 Hùng Vương,"428-430 Hùng Vương, Phường Vĩnh Trung, Quận Thanh Khê, Thành phố Đà Nẵng",16.0666235,108.2106461
PMC,DNPMC466_71 Ngô Gia Tự,"71 Ngô Gia Tự, Phường Tân Lập, Thành phố Nha Trang, Tỉnh Khánh Hòa",12.242242,109.1892926
PMC,DNPMC970_563 Núi Thành,"563 Núi Thành, Phường Hòa Cường Nam, Quận Hải Châu, Thành phố Đà Nẵng",16.0313989477,108.2227086694
PMC,HNPMC1084_Số 97 đường Bạch Đằng,"Số 97 đường Bạch Đằng, Phường Hạ Lý, Quận Hồng Bàng, Thành phố Hải Phòng",20.8617781102,106.6735566237
PMC,HNPMC1609_Căn số TT1-28,"Căn số TT1-28, Xã Tứ Hiệp, Huyện Thanh Trì, Thành phố Hà Nội",20.94131,105.8494
PMC,HNPMC1642_37 Phan Bội Châu,"37 Phan Bội Châu, Phường Quán Bàu, Thành phố Vinh, Tỉnh Nghệ An",18.6870767796,105.670702949
PMC,HNPMC1652_Số 24 Lê Lợi,"Số 24 Lê Lợi, Phường Gia Viên, Quận Ngô Quyền, Thành phố Hải Phòng",20.8602468876,106.6939293567
PMC,DNPMC901_06 Huỳnh Ngọc Huệ,"06 Huỳnh Ngọc Huệ, Phường Thanh Khê Đông, Quận Thanh Khê, Thành phố Đà Nẵng",16.064401,108.1837109
PMC,HNPMC282_191 Phùng Hưng,"191 Phùng Hưng, Phường Phúc La, Quận Hà Đông, Thành phố Hà Nội",20.9685881,105.7861598
PMC,HNPMC1700_Hd09- 20 KCT-Ccko 2-Dự Án Khu Đô Thị Gia,"Hd09- 20 KCT-Ccko 2-Dự Án Khu Đô Thị Gia, Thị Trấn Trâu Quỳ, Huyện Gia Lâm, Thành phố Hà Nội",21.0013778484,105.9423065603
PMC,HNPMC329_27 Xuân Diệu,"27 Xuân Diệu, Phường Quảng An, Quận Tây Hồ, Thành phố Hà Nội",21.0628623,105.8294239
PMC,HNPMC538_GHKD số 101 nhà HHCT HH2 (G2) Vinhomes Green Bay,"GHKD số 101 nhà HHCT HH2 (G2) Vinhomes Green Bay, Phường Mễ Trì, Quận Nam Từ Liêm, Thành phố Hà Nội",21.0007833348,105.7839432238
PMC,HNPMC910_Số 243 Minh Khai,"Số 243 Minh Khai, Phường Đông Ngàn, Thị xã Từ Sơn, Tỉnh Bắc Ninh",21.1229221,105.968582
PMC,HNPMC421_Ô 19 - Lô 7 khu di dân Đền Lừ 2,"Ô 19 - Lô 7 khu di dân Đền Lừ 2, Phường Hoàng Văn Thụ, Quận Hoàng Mai, Thành phố Hà Nội",20.9859660931,105.8578677004
PMC,HNPMC941_56 Dương Khuê,"56 Dương Khuê, Phường Mai Dịch, Quận Cầu Giấy, Thành phố Hà Nội",21.034692639,105.7728560963
PMC,SGPMC057_151 Đồng Đen ,"151 Đồng Đen , Phường 13, Quận Tân Bình, Thành phố Hồ Chí Minh",10.7902769,106.6433607
PMC,SGPMC1038_47 Ngô Gia Tự,"47 Ngô Gia Tự, Phường 6, Thành phố Sóc Trăng, Tỉnh Sóc Trăng",9.6082461,105.9725545
PMC,SGPMC1075_G5-A1 Bùi Quang Trinh,"G5-A1 Bùi Quang Trinh, Phường Phú Thứ, Quận Cái Răng, Thành phố Cần Thơ",10.0033927,105.8058912
PMC,SGPMC1127_41 Lê Duẩn,"41 Lê Duẩn, Phường 3, Thành phố Sóc Trăng, Tỉnh Sóc Trăng",9.5945996107,105.971647889
PMC,SGPMC1158_51 Nguyễn Hữu Cảnh,"51 Nguyễn Hữu Cảnh, Phường Châu Phú A, Thành phố Châu Đốc, Tỉnh An Giang",10.710245266,105.1186348071
PMC,SGPMC1197_648 đường số 4,"648 đường số 4, Thị trấn Thứ Ba, Huyện An Biên, Tỉnh Kiên Giang",9.8123358,105.0621087
PMC,SGPMC1224_333 Nguyễn Trọng Tuyển,"333 Nguyễn Trọng Tuyển, Phường 01, Quận Tân Bình, Thành phố Hồ Chí Minh",10.7982491,106.668452
PMC,SGPMC1085_54-56-58 Lê Lợi,"54-56-58 Lê Lợi, Phường 6, Thành phố Sóc Trăng, Tỉnh Sóc Trăng",9.6085681223,105.9739897476
PMC,SGPMC1242_75 Quốc Lộ 20,"75 Quốc Lộ 20, Thị trấn Liên Nghĩa, Huyện Đức Trọng, Tỉnh Lâm Đồng",11.7545292,108.3917158
PMC,SGPMC1265_76 Đường Hùng Vương,"76 Đường Hùng Vương, Phường 2, Thành phố Sa Đéc, Tỉnh Đồng Tháp",10.2895232684,105.7671883085
PMC,SGPMC125_BA-S01B Tầng Trệt Khu Thương Mại Tòa Nhà Bali - Dự Án New City Số 17 Mai Chí Thọ,"BA-S01B Tầng Trệt Khu Thương Mại Tòa Nhà Bali - Dự Án New City Số 17 Mai Chí Thọ, Phường Bình Khánh, Quận 2, Thành phố Hồ Chí Minh",10.7815767,106.7362699
PMC,SGPMC1395_252 Vạn Kiếp,"252 Vạn Kiếp, Phường 03, Quận Bình Thạnh, Thành phố Hồ Chí Minh",10.797786098,106.6936270987
PMC,SGPMC1576_391 Đường QL14,"391 Đường QL14, Phường Tân Bình, Thị xã Đồng Xoài, Tỉnh Bình Phước",11.5374812577,106.9019748923
PMC,SGPMC149_52 Tân Quý,"52 Tân Quý, Phường Tân Quý, Quận Tân Phú, Thành phố Hồ Chí Minh",10.7966048,106.6198528
PMC,SGPMC1675_15 Bis khu phố Bình Hòa,"15 Bis khu phố Bình Hòa, Phường Lái Thiêu, Thị xã Thuận An, Tỉnh Bình Dương",10.9155581193,106.70825229
PMC,SGPMC1614_F229,"F229, Phường Thống Nhất, Thành phố Biên Hòa, Tỉnh Đồng Nai",10.9474003002,106.8288740751
PMC,SGPMC194_5/1 Bùi Chu,"5/1 Bùi Chu, Xã Trung Chánh, Huyện Hóc Môn, Thành phố Hồ Chí Minh",10.8611540822,106.6100557522
PMC,SGPMC221_69 Vĩnh Hội,"69 Vĩnh Hội, Phường 04, Quận 4, Thành phố Hồ Chí Minh",10.7562099,106.7039657
PMC,SGPMC238_97 Hai Bà Trưng,"97 Hai Bà Trưng, Phường Bến Nghé, Quận 1, Thành phố Hồ Chí Minh",10.777227,106.704081
PMC,SGPMC230_Cửa Hàng Xăng Dầu số 32 - 158 Hùng Vương,"Cửa Hàng Xăng Dầu số 32 - 158 Hùng Vương, Phường 02, Quận 10, Thành phố Hồ Chí Minh",10.7613965802,106.6751635196
PMC,SGPMC272_128H Phạm Văn Hai,"128H Phạm Văn Hai, Phường 03, Quận Tân Bình, Thành phố Hồ Chí Minh",10.7936366,106.6628568
PMC,SGPMC277_122 Hoàng Diệu 2 ,"122 Hoàng Diệu 2 , Phường Linh Chiểu, Quận Thủ Đức, Thành phố Hồ Chí Minh",10.8564734069,106.7659453029
PMC,SGPMC285_224 đường 3/2,"224 đường 3/2, Phường Hưng Lợi, Quận Ninh Kiều, Thành phố Cần Thơ",10.0224542,105.7656635
PMC,SGPMC314_340 Lê Văn Lương,"340 Lê Văn Lương, Phường Tân Hưng, Quận 7, Thành phố Hồ Chí Minh",10.7409356527,106.7037517823
PMC,SGPMC397_393 Nguyễn Thị Thập,"393 Nguyễn Thị Thập, Phường Tân Phong, Quận 7, Thành phố Hồ Chí Minh",10.7385320107,106.7128616856
PMC,SGPMC414_456A Nguyễn Văn Tăng,"456A Nguyễn Văn Tăng, Phường Long Thạnh Mỹ, Quận 9, Thành phố Hồ Chí Minh",10.8422863346,106.8280179948
PMC,SGPMC383_112 - 114 Bình Quới,"112 - 114 Bình Quới, Phường 27, Quận Bình Thạnh, Thành phố Hồ Chí Minh",10.8164621,106.7195388
PMC,SGPMC430_68 đường số 1,"68 đường số 1, Phường Phú Hữu, Quận 9, Thành phố Hồ Chí Minh",10.8040137,106.7901816
PMC,SGPMC455_TM-01 Tầng 1 + tầng lửng 0.01 thuộc CCCT và TMDV VP - 510 Kinh Dương Vương,"TM-01 Tầng 1 + tầng lửng 0.01 thuộc CCCT và TMDV VP - 510 Kinh Dương Vương, Phường An Lạc A, Quận Bình Tân, Thành phố Hồ Chí Minh",10.7372772,106.6141895
PMC,SGPMC556_258 CMT8,"258 CMT8, Phường Phước Hiệp, Thành phố Bà Rịa, Tỉnh Bà Rịa - Vũng Tàu",10.4959697,107.1702844
PMC,SGPMC558_Số 705 Quốc Lộ 20,"Số 705 Quốc Lộ 20, Thị trấn Liên Nghĩa, Huyện Đức Trọng, Tỉnh Lâm Đồng",11.72939,108.37172
PMC,SGPMC501_315 Đường 30 Tháng 04,"315 Đường 30 Tháng 04, Phường Quyết Thắng, Thành phố Biên Hòa, Tỉnh Đồng Nai",10.9494412,106.8208014
PMC,SGPMC573_RS4 Block Riches thuộc DA CCCT kết hợp TMDV&VP tại số 207C Nguyễn Xí,"RS4 Block Riches thuộc DA CCCT kết hợp TMDV&VP tại số 207C Nguyễn Xí, Phường 26, Quận Bình Thạnh, Thành phố Hồ Chí Minh",10.81671,106.70568
PMC,SGPMC589_3/4 đường Thủ Khoa Huân,"3/4 đường Thủ Khoa Huân, Phường Bình Chuẩn, Thị xã Thuận An, Tỉnh Bình Dương",10.98169,106.72109
PMC,SGPMC603_1024 Nguyễn Ái Quốc,"1024 Nguyễn Ái Quốc, Phường Trảng Dài, Thành phố Biên Hòa, Tỉnh Đồng Nai",10.96915307,106.8621979
PMC,SGPMC602_1368 Nguyễn Duy Trinh,"1368 Nguyễn Duy Trinh, Phường Long Trường, Quận 9, Thành phố Hồ Chí Minh",10.80587311,106.8182037
